Name,Link,Documents,Citations,H-index,Coauthor1,CoauthorNo1,Coauthor2,CoauthorNo2,Coauthor3,CoauthorNo3,Coauthor4,CoauthorNo4,Coauthor5,CoauthorNo5,Coauthor6,CoauthorNo6,Coauthor7,CoauthorNo7,Coauthor8,CoauthorNo8,Topic1,Topic2,Topic3,Topic4,Topic5,article,conference paper,book chapter,editorial,review,book,erratum,letter,Publications2021,Publications2020,Publications2019,Publications2018,Publications2017,Publications2016,Publications2015,Publications2014,Publications2013,Publications2012,Publications2011,Publications2010,Publications2009,Publications2008,Publications2007,Publications2006,Publications2005,Publications2004,Publications2003,Publications2002,Publications2001,Publications2000,Publications1999,Publications1998,Publications1997,Publications1996,Publications1995,Publications1994,Publications1993,Publications1992,Publications1991,Publications1990,Publications1989,Publications1988,Publications1987,Publications1986,Publications1985,Publications1984,Publications1983,Publications1982,Publications1981,Publications1980,Publications1979,Publications1978,Publications1977,Publications1976,Publications1975,Publications1974,Publications1973,Publications1972,Publications1971,Publications1970,Citations2021,Citations2020,Citations2019,Citations2018,Citations2017,Citations2016,Citations2015,Citations2014,Citations2013,Citations2012,Citations2011,Citations2010,Citations2009,Citations2008,Citations2007,Citations2006,Citations2005,Citations2004,Citations2003,Citations2002,Citations2001,Citations2000,Citations1999,Citations1998,Citations1997,Citations1996,Citations1995,Citations1994,Citations1993,Citations1992,Citations1991,Citations1990,Citations1989,Citations1988,Citations1987,Citations1986,Citations1985,Citations1984,Citations1983,Citations1982,Citations1981,Citations1980,Citations1979,Citations1978,Citations1977,Citations1976,Citations1975,Citations1974,Citations1973,Citations1972,Citations1971,Citations1970
"Radwan, Ahmed G.",https://08105ofxv-1103-y-https-www-scopus-com.mplbci.ekb.eg/authid/detail.uri?authorId=7103379659,365,6357,45,"Soliman, Ahmed M.",72,"Fouda, Mohammed E.",70,"Elwakil, Ahmed S.",55,"Salama, Khaled Nabil",36,"AbdelAty, Amr M.",32,"Sayed, Wafaa S.",32,"Tolba, Mohamed F.",32,"Abd-El-Hafiz, Salwa K.",28,Fractional Order; Differentiators; Low Pass Filters,Memristors; RRAM; Chaotic Circuit,Chaotic Attractor; Chua's Circuit; Scroll,Image Encryption; Chaotic Map; Hyperchaotic System,Fractional-Order System; Projective Synchronization; Memristors,169,164,18,7,5,1,1,0,15,39,60,44,38,41,29,15,23,19,24,5,2,3,2,0,0,2,3,0,0,0,0,0,1,0,0,0,0,0,0,0,0,0,0,0,0,0,0,0,0,0,0,0,0,0,0,0,0,0,0,0,569,1166,1056,1075,765,526,380,220,273,143,100,52,14,6,5,4,2,1,0,0,0,0,0,0,0,0,0,0,0,0,0,0,0,0,0,0,0,0,0,0,0,0,0,0,0,0,0,0,0,0,0,0
"Tawfik, Abdel Nasser",https://08105ofxv-1103-y-https-www-scopus-com.mplbci.ekb.eg/authid/detail.uri?authorId=36635081200,171,3598,30,"Magdy, Niseem",49,"Rogachevskiy, Oleg V.",45,"Adamczyk, Leszek",44,"Adkins, J. K.",44,"Agakishiev, Geydar",44,"Ahammed, Zubayer",44,"Aparin, Alexey",44,"Aschenauer, Elke Caroline",44,Ionic Collisions; Relativistic Heavy-ion Collisions; Quark-Gluon Plasma,Ionic Collisions; Strangeness; Hadrons,Quantum Chromodynamics; Lattice QCD; Ionic Collisions,Ionic Collisions; Quark-Gluon Plasma; Relativistic Heavy-ion Collisions,Quantum Chromodynamics; Mesons; Chiral Symmetry,153,13,0,0,5,0,0,0,4,6,8,13,20,32,25,11,9,7,6,3,1,0,0,2,4,3,2,0,2,1,4,4,3,1,0,0,0,0,0,0,0,0,0,0,0,0,0,0,0,0,0,0,0,0,0,0,0,0,0,0,298,581,515,502,361,313,188,177,130,108,62,36,33,24,37,70,78,36,10,11,12,9,7,0,0,0,0,0,0,0,0,0,0,0,0,0,0,0,0,0,0,0,0,0,0,0,0,0,0,0,0,0
"Madian, Ahmed H.",https://08105ofxv-1103-y-https-www-scopus-com.mplbci.ekb.eg/authid/detail.uri?authorId=15049578500,158,1361,20,"Soliman, Ahmed M.",45,"Amer, Hassanein Hamed",18,"Tolba, Mohamed F.",18,"Abdelhalim, Mohamed Bakr",15,"Ismail, Samar Moustafa",13,"Abu-ElYazeed, Mohamed Fathy",12,"Elwakil, Ahmed S.",11,"Amer, Sherif H.",9,Fractional Order; Differentiators; Low Pass Filters,Memristors; RRAM; Chaotic Circuit,Chaotic Attractor; Chua's Circuit; Scroll,Transconductance; Differencing; All-pass Filters,Image Encryption; Chaotic Map; Hyperchaotic System,42,110,2,2,1,0,1,0,6,13,27,16,14,22,11,7,6,7,7,8,3,3,5,2,1,0,0,0,0,0,0,0,0,0,0,0,0,0,0,0,0,0,0,0,0,0,0,0,0,0,0,0,0,0,0,0,0,0,0,0,174,342,291,249,85,53,30,28,43,13,20,11,8,8,6,0,0,0,0,0,0,0,0,0,0,0,0,0,0,0,0,0,0,0,0,0,0,0,0,0,0,0,0,0,0,0,0,0,0,0,0,0
"Said, Lobna A.",https://08105ofxv-1103-y-https-www-scopus-com.mplbci.ekb.eg/authid/detail.uri?authorId=36740094700,115,1218,20,"Soliman, Ahmed M.",39,"Fouda, Mohammed E.",17,"Tolba, Mohamed F.",17,"Elwakil, Ahmed S.",14,"Abu-ElYazeed, Mohamed Fathy",13,"Ismail, Samar Moustafa",13,"Khalil, Nariman A.",12,"AbdelAty, Amr M.",11,Fractional Order; Differentiators; Low Pass Filters,Memristors; RRAM; Chaotic Circuit,Chaotic Attractor; Chua's Circuit; Scroll,Transconductance; Differencing; All-pass Filters,Fractional-Order System; PID Controller; Robust Stabilization,50,61,2,0,1,0,1,0,10,23,35,16,13,5,6,1,0,1,4,1,0,0,0,0,0,0,0,0,0,0,0,0,0,0,0,0,0,0,0,0,0,0,0,0,0,0,0,0,0,0,0,0,0,0,0,0,0,0,0,0,213,401,303,206,63,19,3,2,5,0,3,0,0,0,0,0,0,0,0,0,0,0,0,0,0,0,0,0,0,0,0,0,0,0,0,0,0,0,0,0,0,0,0,0,0,0,0,0,0,0,0,0
"Khalil, Tarek M.",https://08105ofxv-1103-y-https-www-scopus-com.mplbci.ekb.eg/authid/detail.uri?authorId=7005286039,95,1047,18,"Abdel-Moty, Elsayed",18,"Fishbain, David A.",14,"Cutler, Robert Brian",11,"Waly, Sherif M.",10,"Genaidy, Ash M.",9,"Rosomoff, Rennée Steele",9,"Steele-Rosomoff, Renee",9,"Goldberg, Myron L.",6,Entrepreneurial Intention; Effectuation; Opportunity Recognition,Open Government; E-Participation; E-Governance,Foresight; Innovation Policy; Technology and Innovation,Asian Financial Crisis; Protectionism; ASEAN Economic Community,No topic,61,29,1,0,3,0,0,1,0,3,1,1,0,1,1,0,0,0,1,1,1,0,0,0,1,2,2,1,1,0,2,0,1,3,2,4,3,2,1,4,0,8,5,5,1,7,1,0,2,0,1,1,4,3,1,6,8,3,0,0,10,16,26,15,26,21,25,23,33,29,20,30,33,24,34,52,35,50,67,52,50,47,34,45,45,53,29,11,18,18,11,8,7,4,11,3,1,3,4,5,4,6,1,1,1,3,1,1,1,0,0,0
"Ismail, Tawfik",https://08105ofxv-1103-y-https-www-scopus-com.mplbci.ekb.eg/authid/detail.uri?authorId=36009912100,81,210,8,"Nasr, Mohamed El Saeed",7,"Selmy, Hossam A.I.",7,"Fahim, Irene Samy",6,"Gabran, Salam R.I.",6,"Singh, Ghanshyam",6,"Al-Nahhal, Mohamed",5,"Alshaer, Nancy",5,"Badr, Yahia Abdel Hamid",5,Free-Space Optical Communication; Atmospheric Turbulence; Meije G-Function,Network on Chip; Fault-Tolerant Routing; Virtual Channel,Visible Light Communication; Optical Wireless; Orthogonal Frequency Division Multiplexing (OFDM),Electrocardiograph; Compressed Sensing; Data Compression,Injection Locking; Amplitude Shift Keying; Quantum Dash Lasers,24,56,0,1,0,0,0,0,6,24,12,12,4,10,7,1,2,1,1,0,1,0,0,0,0,0,0,0,0,0,0,0,0,0,0,0,0,0,0,0,0,0,0,0,0,0,0,0,0,0,0,0,0,0,0,0,0,0,0,0,44,55,46,29,14,11,7,0,2,1,0,1,0,0,0,0,0,0,0,0,0,0,0,0,0,0,0,0,0,0,0,0,0,0,0,0,0,0,0,0,0,0,0,0,0,0,0,0,0,0,0,0
"El-Sherif, Amr A.",https://08105ofxv-1103-y-https-www-scopus-com.mplbci.ekb.eg/authid/detail.uri?authorId=23566337700,63,397,10,"Mohamed, Amr",13,"Sultan, Ahmed K.",7,"El-Khamy, Said E.",6,"Liu, K. J.R.",6,"Afify, Laila Hesham",5,"Moussa, Karim H.",5,"Arafa, Ahmed M.",4,"Awad, Alaa",4,Cognitive Radio Networks; Random Access; Carrier Sense Multiple Access,Multiple-Input Multiple-Output (MIMO) System; Precoding; MIMO System,Caching; Radio Access Networks; Zipf Distribution,Cellular Networks; Power Allocation; Relay Selection,Amplify-And-Forward; Relay Selection; Cooperative Communication,15,48,0,0,0,0,0,0,2,3,8,5,5,6,5,8,5,4,6,2,1,1,1,0,1,0,0,0,0,0,0,0,0,0,0,0,0,0,0,0,0,0,0,0,0,0,0,0,0,0,0,0,0,0,0,0,0,0,0,0,19,47,53,35,50,43,42,43,34,21,2,5,2,1,0,0,0,0,0,0,0,0,0,0,0,0,0,0,0,0,0,0,0,0,0,0,0,0,0,0,0,0,0,0,0,0,0,0,0,0,0,0
"Soltan, Ahmed",https://08105ofxv-1103-y-https-www-scopus-com.mplbci.ekb.eg/authid/detail.uri?authorId=26025748900,63,691,12,"Soliman, Ahmed M.",14,"Yakovlev, Alexandre",9,"Dehkhoda, Fahimeh",8,"Maaskant, Pleun P.",7,"Luo, Junwen",6,"Ramezani, Reza",6,"Bunnam, Thanasin",5,"Constandinou, Timothy G.",5,Channelrhodopsins; Optogenetics; Designer Drugs,Fractional Order; Differentiators; Low Pass Filters,Chopper Amplifiers; Front-End; CMOS,Memristors; RRAM; Chaotic Circuit,Approximate Design; Voltage Scaling; Multipliers,22,41,0,0,0,0,0,0,0,10,14,12,7,8,3,2,3,1,1,0,1,1,0,0,0,0,0,0,0,0,0,0,0,0,0,0,0,0,0,0,0,0,0,0,0,0,0,0,0,0,0,0,0,0,0,0,0,0,0,0,45,123,157,137,96,73,34,8,12,3,2,0,1,0,0,0,0,0,0,0,0,0,0,0,0,0,0,0,0,0,0,0,0,0,0,0,0,0,0,0,0,0,0,0,0,0,0,0,0,0,0,0
"Azer, Marianne Amir",https://08105ofxv-1103-y-https-www-scopus-com.mplbci.ekb.eg/authid/detail.uri?authorId=24476232400,58,214,9,"Abdelbaki, Nashwa",3,"Allam, Mahmoud",3,"El-Zoghby, Ayman M.",3,"Abdelrazek, Loav",2,"Abo-Soliman, Mohamed A.",2,"Abuzaid, Mohamad M.",2,"ElSayed, Mahmoud Said",2,"ElShafee, Ahmed M.",2,Fog Computing; Blockchain; Internet of Things,Vehicular Ad Hoc Networks; Location Privacy; Revocation,SCADA System; Supervisory Control; Intrusion Detection,Stream Ciphers; Wi-Fi; Denial-Of-Service Attack,Connected Vehicles; CAN Bus; Electronic Control,3,55,0,0,0,0,0,0,2,5,8,13,1,2,1,1,6,2,4,2,4,3,3,1,0,0,0,0,0,0,0,0,0,0,0,0,0,0,0,0,0,0,0,0,0,0,0,0,0,0,0,0,0,0,0,0,0,0,0,0,8,43,33,27,14,14,11,6,8,6,21,14,6,2,1,0,0,0,0,0,0,0,0,0,0,0,0,0,0,0,0,0,0,0,0,0,0,0,0,0,0,0,0,0,0,0,0,0,0,0,0,0
"Yousef, Ahmed Hassan",https://08105ofxv-1103-y-https-www-scopus-com.mplbci.ekb.eg/authid/detail.uri?authorId=57217371978,50,1261,9,"Medhat, Walaa",4,"Mohamed, Hoda Korashy",4,"Sheirah, Mohammed A.H.",4,"Abdullah, Bassem A.",3,"El-Kassas, Wafaa S.",3,"El-Lateef, Tamer Abd",3,"Fahmy, Ahmed F.",3,"Hamza, Rameez B.",3,Timetabling Problem; Hyper-heuristics; University Examination,Model-Driven Development; Model Driven Architecture; Mobile Applications,Sentiment Classification; Opinion Mining; Product Review,Software Metrics; Maintainability; Object-Oriented,Lane Detection; Vanishing Point; Driver Assistance,12,38,0,0,0,0,0,0,0,8,7,6,3,2,3,5,3,0,3,2,3,2,0,1,0,2,0,0,0,0,0,0,0,0,0,0,0,0,0,0,0,0,0,0,0,0,0,0,0,0,0,0,0,0,0,0,0,0,0,0,89,282,307,237,153,102,47,7,8,15,8,2,2,2,0,0,0,0,0,0,0,0,0,0,0,0,0,0,0,0,0,0,0,0,0,0,0,0,0,0,0,0,0,0,0,0,0,0,0,0,0,0
"ElHelw, Mohamed A.",https://08105ofxv-1103-y-https-www-scopus-com.mplbci.ekb.eg/authid/detail.uri?authorId=7801537176,47,544,11,"Chung, Adrian J.",6,"Salaheldin, Ahmed",6,"ElHakim, Reda",5,"Atallah, Louis",4,"Darzi, Ara Warkes",4,"El Gayar, Neamat",4,"Taie, Mostafa Anwar",4,"Alsebai, A.",3,Object Detection; CNN; IOU,Correlation Filter; Visual Tracking; Multiple Object Tracking,Character Recognition; Tesseract; Template Matching,Conditional Random Fields; Parsing; Superpixels,Vehicle Detection; Aerial Image; Unmanned Aerial Vehicles,6,41,0,0,0,0,0,0,0,3,1,2,2,2,2,6,4,7,1,6,1,2,2,1,1,2,2,0,0,0,0,0,0,0,0,0,0,0,0,0,0,0,0,0,0,0,0,0,0,0,0,0,0,0,0,0,0,0,0,0,21,56,90,62,53,60,45,36,22,24,19,19,17,9,6,2,1,2,0,0,0,0,0,0,0,0,0,0,0,0,0,0,0,0,0,0,0,0,0,0,0,0,0,0,0,0,0,0,0,0,0,0
"Akl, W.",https://08105ofxv-1103-y-https-www-scopus-com.mplbci.ekb.eg/authid/detail.uri?authorId=6507413652,46,514,13,"Elnady, Tamer",7,"Aldraihem, Osama J.",4,"Farooqui, Maaz",3,"Ruzzene, Massimo",3,"Al-Mitani, K.",2,"Allam, Ahmed",2,"Arafa, Mustafa H.",2,"Nabawy, Mostafa R.A.",2,Metamaterials; Sound Transmission; Acoustics,Piezoelectric Crystals; Metamaterials; Energy Gap,Styrene-Butadiene Rubber; Scorch; Treads,Wrinkle; Inflatable Structures; Solar Sails,Turbine Blades; Flutter; Momentum Theory,33,13,0,0,0,0,0,0,2,2,2,1,1,3,1,1,2,5,4,6,3,4,2,2,1,1,0,2,1,0,0,0,0,0,0,0,0,0,0,0,0,0,0,0,0,0,0,0,0,0,0,0,0,0,0,0,0,0,0,0,36,62,66,59,34,62,27,41,31,40,23,13,8,2,0,0,2,6,1,1,0,0,0,0,0,0,0,0,0,0,0,0,0,0,0,0,0,0,0,0,0,0,0,0,0,0,0,0,0,0,0,0
"Wagdy Mohamed, Ali",https://08105ofxv-1103-y-https-www-scopus-com.mplbci.ekb.eg/authid/detail.uri?authorId=55130632100,45,863,14,"Hadi, Anas A.",9,"Alnowibet, Khalid Abdulaziz",5,"Ganesh, T.",5,"Hassan, Said Ali",5,"Sabry, Hegazy Zaher",4,"Abdelaal, Reda M.S.",3,"El-Quliti, Said Ali Hassan",3,"Elfeky, Ehab Zaki",3,Large-Scale Optimization; Cooperative Coevolution; Differential Evolution,Goal Programming; Differential Evolution Algorithm; Ministry of Education,Constrained Optimization Problem; Constraint Handling; Differential Evolution,Mixed Integer Nonlinear Programming; Quadratic Program; Relaxation,Goal Programming; Transportation Problem; Aspiration Level,34,7,4,0,0,0,0,0,10,11,5,3,4,5,2,1,1,2,1,0,0,0,0,0,0,0,0,0,0,0,0,0,0,0,0,0,0,0,0,0,0,0,0,0,0,0,0,0,0,0,0,0,0,0,0,0,0,0,0,0,201,220,153,97,50,77,25,19,17,4,0,0,0,0,0,0,0,0,0,0,0,0,0,0,0,0,0,0,0,0,0,0,0,0,0,0,0,0,0,0,0,0,0,0,0,0,0,0,0,0,0,0
"Abdelbaki, Nashwa",https://08105ofxv-1103-y-https-www-scopus-com.mplbci.ekb.eg/authid/detail.uri?authorId=55932162200,42,95,5,"Amr, Poussy",2,"Aumann, Bernd",2,"ElBanna, Amr",2,"Gaber, Amira",2,"Heggo, Islam A.",2,"Hussein, Sameh",2,"Naseef, Omnia A.",2,"Radwan, Tarek",2,Malware; Obfuscation; Binary Codes,Digital Forensics; Cybercrime; Court of Law,Web Tracking; Cookies; Online Advertising,Job Posting; Résumé; Recommender Systems,Language Recognition; Hand Gesture; American Sign Language,3,37,2,0,0,0,0,0,2,6,1,11,5,0,1,4,5,0,1,1,0,0,0,0,1,1,1,1,0,0,0,0,0,0,0,0,1,0,0,0,0,0,0,0,0,0,0,0,0,0,0,0,0,0,0,0,0,0,0,0,10,22,23,19,7,6,2,0,1,0,1,0,0,0,0,0,1,2,1,0,0,0,0,0,0,0,0,0,0,0,0,0,0,0,0,0,0,0,0,0,0,0,0,0,0,0,0,0,0,0,0,0
"Ammar, Hossam Hassan",https://08105ofxv-1103-y-https-www-scopus-com.mplbci.ekb.eg/authid/detail.uri?authorId=57189047959,37,123,7,"Sayed, Abdelrahman",5,"Mahmoud, Mohamed Ibrahim",4,"Barakat, Mohamed Hesham",3,"Diab, Mohamed Khaled",3,"Elkholy, Hassan Ashraf",3,"Elsamanty, M.",3,"Ibrahim, Habiba A.",3,"Ibrahim, Zahra Fathy",3,Inverted Pendulum; Mobile Robots; Nonholonomic Constraints,Maximum Power Point Trackers; Powerpoint; Photovoltaic System,Smith Predictor; Internal Model Control; PID Controller,Trajectory Tracking; Altitude Control; Vertical Takeoff and Landing,Visual Servoing; Homography; Mobile Robots,2,35,0,0,0,0,0,0,1,26,6,3,0,1,0,0,0,0,0,0,0,0,0,0,0,0,0,0,0,0,0,0,0,0,0,0,0,0,0,0,0,0,0,0,0,0,0,0,0,0,0,0,0,0,0,0,0,0,0,0,24,85,12,2,0,0,0,0,0,0,0,0,0,0,0,0,0,0,0,0,0,0,0,0,0,0,0,0,0,0,0,0,0,0,0,0,0,0,0,0,0,0,0,0,0,0,0,0,0,0,0,0
"Tolba, Mohamed F.",https://08105ofxv-1103-y-https-www-scopus-com.mplbci.ekb.eg/authid/detail.uri?authorId=56912006300,35,313,10,"Said, Lobna A.",17,"Sayed, Wafaa S.",9,"Abd-El-Hafiz, Salwa K.",8,"Elsafty, Abdulaziz H.",6,"Soliman, Ahmed M.",4,"Abu-ElYazeed, Mohamed Fathy",3,"Al-Qutayri, Mahmoud A.",3,"Elwakil, Ahmed S.",3,Fractional Order; Differentiators; Low Pass Filters,Chaotic Attractor; Chua's Circuit; Scroll,Image Encryption; Chaotic Map; Hyperchaotic System,Memristors; RRAM; Chaotic Circuit,Fractional-Order System; PID Controller; Robust Stabilization,15,18,1,0,1,0,0,0,2,8,12,9,2,1,1,0,0,0,0,0,0,0,0,0,0,0,0,0,0,0,0,0,0,0,0,0,0,0,0,0,0,0,0,0,0,0,0,0,0,0,0,0,0,0,0,0,0,0,0,0,60,103,80,68,1,1,0,0,0,0,0,0,0,0,0,0,0,0,0,0,0,0,0,0,0,0,0,0,0,0,0,0,0,0,0,0,0,0,0,0,0,0,0,0,0,0,0,0,0,0,0,0
"Abd Elkodous, M.",https://08105ofxv-1103-y-https-www-scopus-com.mplbci.ekb.eg/authid/detail.uri?authorId=57201641040,32,410,13,"Pal, Kaushik",11,"Gobara, Mohamed",10,"Abdel Maksoud, M. I.A.",6,"Elsayed, M. A.",5,"Mosallam, Farag M.",5,"Jeevanandam, Jaison",4,"Abdelrahman, Ibrahim Y.",3,"Ashour, Ahmed H.",3,Silver Nanoparticles; Acid Gold Tetrachloride; Biofabrication,Ferrites; Spinell; Dromaiidae,Thin Film Solar Cells; Organic Photovoltaics; Plasmonics,Carbon Dioxide Capture; Tetraethylenepentamine; Adsorbents,Gag Protein; Virus Capsid; Human Immunodeficiency Virus Type 1 P17 Protein,24,0,1,1,6,0,0,0,4,19,7,2,0,0,0,0,0,0,0,0,0,0,0,0,0,0,0,0,0,0,0,0,0,0,0,0,0,0,0,0,0,0,0,0,0,0,0,0,0,0,0,0,0,0,0,0,0,0,0,0,179,204,26,1,0,0,0,0,0,0,0,0,0,0,0,0,0,0,0,0,0,0,0,0,0,0,0,0,0,0,0,0,0,0,0,0,0,0,0,0,0,0,0,0,0,0,0,0,0,0,0,0
"El-Batawy, Yasser M.",https://08105ofxv-1103-y-https-www-scopus-com.mplbci.ekb.eg/authid/detail.uri?authorId=6603406617,30,195,9,"Medhat, Marina",4,"Abdelmageed, Alaa K.",3,"Abouelsaood, Ahmed A.",3,"Soliman, Ezzeldin A.",3,"El-Naggar, Sahar A.",2,"Mahran, Sara E.",2,"Mohammedy, Farseem Mannan",2,"Wafa, Mohamed I.",2,Thin Film Solar Cells; Organic Photovoltaics; Plasmonics,Quantum Well Infrared Photodetectors; Photodetectors; Dark Currents,Avalanche Photodiodes; Ingaas; Inp,Cavity Resonators; Photodetectors; Vertical-Cavity Surface-Emitting Laser (VCSEL),Perovskite Solar Cells; Lead Bromide; Formamidine,15,13,1,0,1,0,0,0,1,4,2,3,2,3,2,2,2,0,0,0,0,0,0,0,3,3,3,0,0,0,0,0,0,0,0,0,0,0,0,0,0,0,0,0,0,0,0,0,0,0,0,0,0,0,0,0,0,0,0,0,6,22,10,17,9,17,23,16,15,5,13,7,4,3,3,5,11,7,2,0,0,0,0,0,0,0,0,0,0,0,0,0,0,0,0,0,0,0,0,0,0,0,0,0,0,0,0,0,0,0,0,0
"Fahim, Irene Samy",https://08105ofxv-1103-y-https-www-scopus-com.mplbci.ekb.eg/authid/detail.uri?authorId=56572668600,30,31,3,"Everitt, Nicola M.",5,"Faisal, Marwa",5,"Chbib, Hani",3,"D'Angelo, Giacomo",3,"Emad, Ahmed",3,"Kassem, Sally S.",3,"Singh, Ghanshyam",3,"Tiwari, Manish",3,Edible Films; Active Food Packaging; Elongation at Break,Microplastics; Marine Debris; Litter,Chitin; Shrimp Shells; Di-O-Butyrylchitin,Musculoskeletal Diseases; Work Posture; Ergonomics,Ergonomics; Workstation Design; Occupational Safety,12,18,0,0,0,0,0,0,5,17,5,2,0,0,1,0,0,0,0,0,0,0,0,0,0,0,0,0,0,0,0,0,0,0,0,0,0,0,0,0,0,0,0,0,0,0,0,0,0,0,0,0,0,0,0,0,0,0,0,0,13,13,2,1,1,1,0,0,0,0,0,0,0,0,0,0,0,0,0,0,0,0,0,0,0,0,0,0,0,0,0,0,0,0,0,0,0,0,0,0,0,0,0,0,0,0,0,0,0,0,0,0
"Abdel-Mottaleb, Mohamed M.S.A.",https://08105ofxv-1103-y-https-www-scopus-com.mplbci.ekb.eg/authid/detail.uri?authorId=7003452761,28,1247,19,"Gesquière, André",7,"Lazzaroni, R.",6,"Müllen, Klaus",6,"Sieffert, Michel",6,"Amabilino, David B.",5,"Abdel-Mottaleb, Mohamed Sabry A.",4,"Feringa, B. L.",4,"Gomar-Nadal, Elba",4,Magnetite Nanoparticles; Dromaiidae; Coercivity,Silver Nanoparticles; Acid Gold Tetrachloride; Biofabrication,Zinc Oxide Nanoparticle; Wurtzite; Zinc Nitrate,No topic,No topic,28,0,0,0,0,0,0,0,0,0,0,1,0,2,1,3,1,0,0,0,0,1,0,3,2,3,5,1,1,3,1,0,0,0,0,0,0,0,0,0,0,0,0,0,0,0,0,0,0,0,0,0,0,0,0,0,0,0,0,0,25,44,61,52,61,76,51,52,53,51,72,82,81,76,82,92,94,51,49,22,15,5,0,0,0,0,0,0,0,0,0,0,0,0,0,0,0,0,0,0,0,0,0,0,0,0,0,0,0,0,0,0
"Darweesh, M. Saeed",https://08105ofxv-1103-y-https-www-scopus-com.mplbci.ekb.eg/authid/detail.uri?authorId=57209697448,28,65,4,"Adel, Mohamed",4,"El-Ghoneimy, Mona M.Riad",4,"Kamal, Hanan Ahmed",4,"Elaskary, Ramez Moh",3,"Adel, Mohamed H.",2,"El Munim, Hossam E.Abd",2,"Elsayed, Khaled M.F.",2,"Gabran, Salam R.I.",2,Handover; Local Thermodynamic Equilibrium; Self-Optimization,Electrocardiograph; Compressed Sensing; Data Compression,Visible Light Communication; Optical Wireless; Orthogonal Frequency Division Multiplexing (OFDM),Lane Detection; Vanishing Point; Driver Assistance,Elasticity Imaging Techniques; S Wave; Breasts,4,24,0,0,0,0,0,0,0,9,8,9,1,1,0,0,0,0,0,0,0,0,0,0,0,0,0,0,0,0,0,0,0,0,0,0,0,0,0,0,0,0,0,0,0,0,0,0,0,0,0,0,0,0,0,0,0,0,0,0,9,29,17,9,1,0,0,0,0,0,0,0,0,0,0,0,0,0,0,0,0,0,0,0,0,0,0,0,0,0,0,0,0,0,0,0,0,0,0,0,0,0,0,0,0,0,0,0,0,0,0,0
"Guindi, Rafik S.",https://08105ofxv-1103-y-https-www-scopus-com.mplbci.ekb.eg/authid/detail.uri?authorId=8278635600,28,167,7,"AbdElSalam, Mohamed",2,"Abdel-Moneum, Mohamed",2,"Abdelmejeed, Mamdouh",2,"Abdo, Islam",2,"Ben Messaoud, Khaled",2,"Brammertz, Guy",2,"Buffière, Marie",2,"Depauw, Valérie",2,Cu2Znsns4; Kesterite; Copper Zinc Tin Sulfide,Systemc; Assertion; RTL,Texturization; Solar Cells; Silicon Wafers,Overlay; Metrology; EUV Lithography,Jitter; Power Supplies; Dynamic Random Access Storage,5,23,0,0,0,0,0,0,0,0,0,0,0,4,4,1,5,2,0,2,0,0,1,2,1,2,2,0,0,0,0,0,0,0,1,0,1,0,0,0,0,0,0,0,0,0,0,0,0,0,0,0,0,0,0,0,0,0,0,0,8,11,18,18,21,14,8,7,4,6,4,6,3,3,5,6,5,14,4,1,0,0,0,0,1,0,0,0,0,0,0,0,0,0,0,0,0,0,0,0,0,0,0,0,0,0,0,0,0,0,0,0
"El-Kafrawy, Passent M.",https://08105ofxv-1103-y-https-www-scopus-com.mplbci.ekb.eg/authid/detail.uri?authorId=57219407679,26,132,5,"Fathi, Hanaa",3,"Manhrawy, Ibrahim I.M.",3,"Qaraad, Mohammed",3,"Abou-Nassar, Eman M.",2,"Elabd, Emad",2,"Elnemr, Rasha",2,"Jamal, Amani Tariq",2,"McCartney, Robert",2,Gene Selection; Cancer Classification; Microarray Data,Hadoop; Distributed File System; Mapreduce,Data Integrity; Auditing; Random Oracle Model,Neurogranin; Cerebrospinal Fluid; Alzheimer's Disease,SWATH (Ship); Liquid Chromatography-Mass Spectrometry; Dependent Data,10,15,0,1,0,0,0,0,1,4,3,7,1,0,3,0,0,2,2,0,1,0,0,0,1,1,0,0,0,0,0,0,0,0,0,0,0,0,0,0,0,0,0,0,0,0,0,0,0,0,0,0,0,0,0,0,0,0,0,0,36,45,19,19,5,3,0,1,0,1,0,1,1,0,0,0,1,0,0,0,0,0,0,0,0,0,0,0,0,0,0,0,0,0,0,0,0,0,0,0,0,0,0,0,0,0,0,0,0,0,0,0
"Guaily, Amr G.",https://08105ofxv-1103-y-https-www-scopus-com.mplbci.ekb.eg/authid/detail.uri?authorId=35728774600,25,116,6,"Elhanafy, Ahmed",3,"Elsaid, Ahmed",3,"Ammar, Hossam Hassan",2,"El-Salamony, Mostafa E.",2,"ElShafei, Ahmed Ibrahim",2,"Moharam, Ahmed",2,"Sallam, Omar Khaled",2,"Abohadima, Samir A.",1,"Abdominal Aortic Aneurysm; N-Acetylval-Nle(7,8)-Allatotropin (5-13); Thrombosis",Articular Cartilage; Proteoglycans; Knees,Biofilms; Free Boundary Value Problems; Hyperbolic Partial Differential Equations,Fluid-Structure Interaction; Conjugate Heat Transfer; Added Mass,Trombe Walls; Solar Chimneys; Natural Ventilation,16,8,0,0,0,0,1,0,3,7,5,0,0,1,3,0,1,1,1,3,0,0,0,0,0,0,0,0,0,0,0,0,0,0,0,0,0,0,0,0,0,0,0,0,0,0,0,0,0,0,0,0,0,0,0,0,0,0,0,0,11,34,16,12,13,7,7,5,2,4,1,4,0,0,0,0,0,0,0,0,0,0,0,0,0,0,0,0,0,0,0,0,0,0,0,0,0,0,0,0,0,0,0,0,0,0,0,0,0,0,0,0
"AbdelSalam, Sherif S.",https://08105ofxv-1103-y-https-www-scopus-com.mplbci.ekb.eg/authid/detail.uri?authorId=34869048200,24,173,7,"Azzam, Salem A.",4,"El-Naggar, Hayel M.",4,"Anwar, Mona Badr El Din",2,"Baligh, Falma A.",2,"Roling, Matthew J.",2,"Abdelal, Mohamed A.",1,"Afifi, Mohamed S.",1,"Ahmed, Mostafa",1,Earth Pressure; Polystyrenes; Retaining Walls,Pile Driving; Load Tests; Bearing Capacity,Steel Fibers; Self Compacting Concrete; Concrete Slabs,No topic,No topic,12,12,0,0,0,0,0,0,0,3,3,2,1,3,1,3,1,1,4,1,1,0,0,0,0,0,0,0,0,0,0,0,0,0,0,0,0,0,0,0,0,0,0,0,0,0,0,0,0,0,0,0,0,0,0,0,0,0,0,0,11,34,26,22,21,13,12,17,5,5,7,0,0,0,0,0,0,0,0,0,0,0,0,0,0,0,0,0,0,0,0,0,0,0,0,0,0,0,0,0,0,0,0,0,0,0,0,0,0,0,0,0
"Elattar, Mustafa A.",https://08105ofxv-1103-y-https-www-scopus-com.mplbci.ekb.eg/authid/detail.uri?authorId=55951661000,24,216,7,"Planken, Robrecht Nils",10,"VanBavel, Ed T.",7,"Wiegerinck, Esther M.A.",7,"Fahmy, Ahmed S.",5,"van Kesteren, Floortje",5,"Osman, Nael F.",4,"Abdelrauof, Dina",3,"Shahin, Ahmed H.",3,Transcatheter Aortic Valve Implantation; Bioprosthesis; Aortic Stenosis,Aortic Valve; Sternotomy; Bioprosthesis,Object Detection; CNN; IOU,Magnetic Resonance Angiography; Gadobutrol; Gadofosveset,Heart Left Ventricle; Cine Magnetic Resonance Imaging; Dice,8,16,0,0,0,0,0,0,1,5,3,1,3,1,2,4,0,0,0,2,0,2,0,0,0,0,0,0,0,0,0,0,0,0,0,0,0,0,0,0,0,0,0,0,0,0,0,0,0,0,0,0,0,0,0,0,0,0,0,0,18,57,38,28,32,17,14,6,1,1,2,2,0,0,0,0,0,0,0,0,0,0,0,0,0,0,0,0,0,0,0,0,0,0,0,0,0,0,0,0,0,0,0,0,0,0,0,0,0,0,0,0
"Kassem, Sally S.",https://08105ofxv-1103-y-https-www-scopus-com.mplbci.ekb.eg/authid/detail.uri?authorId=56960108100,24,106,5,"Mohammed, Ayman R.",4,"Abou-El-Enien, Tarek H.M.",3,"Fahim, Irene Samy",3,"Korayem, Lamiaa",3,"Yasser, Shahd",3,"Abdelsalam, Hisham Mohamed E.",2,"Abdullatif, Nour",2,"Amr, Mohamed",2,Product Platform; Modularization; Design Structure Matrix,Cuculidae; Fireflies; Chiroptera,Vehicle Routing Problem; Pickup and Delivery; Dynamic Routing,Short-Term Load Forecasting; Electricity Price; Power Markets,Bullwhip Effect; Order-Up-To Policy; Supply Chain Performance,10,14,0,0,0,0,0,0,2,10,4,1,2,1,2,0,1,1,0,0,0,0,0,0,0,0,0,0,0,0,0,0,0,0,0,0,0,0,0,0,0,0,0,0,0,0,0,0,0,0,0,0,0,0,0,0,0,0,0,0,16,36,20,11,11,6,3,3,0,0,0,0,0,0,0,0,0,0,0,0,0,0,0,0,0,0,0,0,0,0,0,0,0,0,0,0,0,0,0,0,0,0,0,0,0,0,0,0,0,0,0,0
"Boraey, Mohammed A.",https://08105ofxv-1103-y-https-www-scopus-com.mplbci.ekb.eg/authid/detail.uri?authorId=55084840300,23,372,7,"Hoe, Susan",3,"El-Salamony, Mostafa E.",2,"ElShafei, Ahmed Ibrahim",2,"Epstein, Marcelo",2,"Finlay, Warren H.",2,"Ivey, James W.",2,"Kostenko, Victoria",2,"Lechuga-Ballesteros, David",2,Lattice Boltzmann Method; Chapman-Enskog Expansion; Immersed Boundary,Thermoacoustics; Combustion Stability; Premixed Flames,Oil Pollution; Hydrophobicity; Aerogels,Biofilms; Free Boundary Value Problems; Hyperbolic Partial Differential Equations,Collision Avoidance; Waterways; Ships,13,7,0,0,1,0,1,0,2,3,6,1,0,0,2,4,1,0,1,1,2,0,0,0,0,0,0,0,0,0,0,0,0,0,0,0,0,0,0,0,0,0,0,0,0,0,0,0,0,0,0,0,0,0,0,0,0,0,0,0,48,58,83,36,35,46,28,23,10,2,3,0,0,0,0,0,0,0,0,0,0,0,0,0,0,0,0,0,0,0,0,0,0,0,0,0,0,0,0,0,0,0,0,0,0,0,0,0,0,0,0,0
"Allam, Mahmoud",https://08105ofxv-1103-y-https-www-scopus-com.mplbci.ekb.eg/authid/detail.uri?authorId=7004668825,21,120,6,"Azer, Marianne Amir",3,"Greenleaf, James F.",3,"Mansour, Hala A.K.",3,"Abo-Alsoud, M. A.",2,"Ibrahim, Karim M.",2,"NourElDeen, Pakinam",2,"Selim, Mazen Mohamed",2,"Abdelhalim, Mohamed Bakr",1,Microphone Array; Sound Engineer; Stereophonic Recordings,Connected Vehicles; CAN Bus; Electronic Control,Vehicular Ad Hoc Networks; Location Privacy; Revocation,Ontology Learning; Semantic Web; Natural Language Processing (NLP),No topic,5,15,1,0,0,0,0,0,0,0,1,2,0,2,1,0,0,0,1,1,1,2,0,1,1,1,0,0,0,0,0,0,0,2,3,1,0,1,0,0,0,0,0,0,0,0,0,0,0,0,0,0,0,0,0,0,0,0,0,0,6,13,10,4,4,5,4,5,4,8,5,15,3,3,8,0,1,0,0,4,2,4,0,4,0,4,3,1,0,0,0,0,0,0,0,0,0,0,0,0,0,0,0,0,0,0,0,0,0,0,0,0
