"El-Hadidi, Mohamed",https://08105ofxv-1103-y-https-www-scopus-com.mplbci.ekb.eg/authid/detail.uri?authorId=57062645000,18,838,7,"Kappler, Andreas Kappler",4,"Bakry, Usama",3,"Harter, Johannes",3,"Kishk, Ali",3,"Diab, Aya A.",2,"Elanany, Mervat Gaber",2,"Elzayat, Mariam G.",2,"Fares, Mohamed",2,Biochar; Soil Amendments; Black Carbon,Metagenome; Binning; Microbial Genome,Intestine Flora; Ruminococcaceae; Dysbiosis,Antibiotic Resistome; Tetracycline Resistance; Integrons,Pure Autonomic Failure; 3-Iodobenzylguanidine; Alpha Synuclein,11,6,0,0,0,0,1,0,0,5,6,1,2,3,1,0,0,0,0,0,0,0,0,0,0,0,0,0,0,0,0,0,0,0,0,0,0,0,0,0,0,0,0,0,0,0,0,0,0,0,0,0,0,0,0,0,0,0,0,0,130,226,215,184,74,9,0,0,0,0,0,0,0,0,0,0,0,0,0,0,0,0,0,0,0,0,0,0,0,0,0,0,0,0,0,0,0,0,0,0,0,0,0,0,0,0,0,0,0,0,0,0
"Shosha, Ahmed F.",https://08105ofxv-1103-y-https-www-scopus-com.mplbci.ekb.eg/authid/detail.uri?authorId=54783521500,18,74,5,"Liu, Chenching",5,"Abdelbaki, Nashwa",2,"Tobin, Lee",2,"Wu, Shinnshyan",2,"Abdelazim, Mohamed T.",1,"Abdelkhalek, Moataz",1,"Elsayed, Yahia",1,"Gladyhsev, Pavel",1,Malware; Javascript; Blacklisting,Digital Forensics; Cybercrime; Court of Law,Malware; Permission; Drebrins,Malware; Obfuscation; Binary Codes,Direct Numerical Simulation; Resolvers; Names,1,13,4,0,0,0,0,0,0,0,0,2,4,0,0,3,3,4,2,0,0,0,0,0,0,0,0,0,0,0,0,0,0,0,0,0,0,0,0,0,0,0,0,0,0,0,0,0,0,0,0,0,0,0,0,0,0,0,0,0,2,16,9,14,5,6,7,5,7,3,0,0,0,0,0,0,0,0,0,0,0,0,0,0,0,0,0,0,0,0,0,0,0,0,0,0,0,0,0,0,0,0,0,0,0,0,0,0,0,0,0,0
"Afify, Laila Hesham",https://08105ofxv-1103-y-https-www-scopus-com.mplbci.ekb.eg/authid/detail.uri?authorId=56429489400,17,246,5,"ElSawy, Hesham",6,"El-Sherif, Amr A.",5,"Digham, Fadel F.A.",3,"ElBatt, Tamer A.",3,"Abdelradi, Yasmeen M.",2,"Hassan, Abdulmoneam A.",2,"Masood, Mudassir",2,"Nafie, Mohammed H.",2,Stochastic Geometry; Cellular Networks; Coverage Probability,Multiple-Input Multiple-Output (MIMO) System; Precoding; MIMO System,Caching; Radio Access Networks; Zipf Distribution,Cellular Networks; Power Allocation; Relay Selection,Machine-To-Machine Communication; Random Access; Local Thermodynamic Equilibrium,4,13,0,0,0,0,0,0,0,2,3,1,1,2,5,1,0,1,1,0,0,0,0,0,0,0,0,0,0,0,0,0,0,0,0,0,0,0,0,0,0,0,0,0,0,0,0,0,0,0,0,0,0,0,0,0,0,0,0,0,10,23,37,55,49,32,20,13,6,1,0,0,0,0,0,0,0,0,0,0,0,0,0,0,0,0,0,0,0,0,0,0,0,0,0,0,0,0,0,0,0,0,0,0,0,0,0,0,0,0,0,0
"Shalaby, R.",https://08105ofxv-1103-y-https-www-scopus-com.mplbci.ekb.eg/authid/detail.uri?authorId=57189045808,16,86,5,"Ibrahim, Mohammed",3,"Abo-Zalam, Belal A.",2,"El-Hossainy, Mohammad",2,"Hamdy, Mohamed",2,"Khalifa, Tarek R.",2,"Mahmoud, Mohamed Ibrahim",2,"Raisch, Jörg",2,"Sallam, Mostafa",2,Maximum Power Point Trackers; Powerpoint; Photovoltaic System,Fractional-Order System; PID Controller; Robust Stabilization,Underactuated Mechanical Systems; Inverted Pendulum; Carts,Cranes; Overhead; Underactuated System,Fuzzy Controller; PID Control; DC Motor,7,9,0,0,0,0,0,0,1,7,4,1,0,1,0,0,0,0,1,0,0,1,0,0,0,0,0,0,0,0,0,0,0,0,0,0,0,0,0,0,0,0,0,0,0,0,0,0,0,0,0,0,0,0,0,0,0,0,0,0,18,29,12,6,5,3,2,6,1,0,2,0,1,1,0,0,0,0,0,0,0,0,0,0,0,0,0,0,0,0,0,0,0,0,0,0,0,0,0,0,0,0,0,0,0,0,0,0,0,0,0,0
"Elmahdy, Hesham Nabih",https://08105ofxv-1103-y-https-www-scopus-com.mplbci.ekb.eg/authid/detail.uri?authorId=6508156812,15,74,4,"Ghany, Kareem Kamal A.",2,"Khalifa, Nour Eldeen M.",2,"Mostafa, Fatma A.",2,"Refaey, Mohammed Ahmed A.",2,"Rjoob, Khaled Waleed Younis",2,"Taha, Sanaa",2,"AlMeghari, Mayada",1,"Aly, Imane",1,Ears; Biometry; Local Features,Pedestrian Detection; California Institute of Technology; Histograms,Heart Sounds; Phonocardiography; Stethoscopes,Evidence-Based Medicine; Clubs; Mccoll,Body Sensor Networks; Key Agreement; Authentication,5,9,0,0,0,0,1,0,0,3,2,0,0,1,4,0,0,0,1,0,2,0,1,0,0,0,1,0,0,0,0,0,0,0,0,0,0,0,0,0,0,0,0,0,0,0,0,0,0,0,0,0,0,0,0,0,0,0,0,0,14,17,22,7,5,3,2,0,2,1,1,0,0,0,0,0,0,0,0,0,0,0,0,0,0,0,0,0,0,0,0,0,0,0,0,0,0,0,0,0,0,0,0,0,0,0,0,0,0,0,0,0
"Hussein, Bassam A.",https://08105ofxv-1103-y-https-www-scopus-com.mplbci.ekb.eg/authid/detail.uri?authorId=55939068000,15,292,8,"Nada, Ayman A.",3,"Sugiyama, Hiroyuki",2,"Weed, David A.",2,"Abouel Fotouh, Aziz M.",1,"Brown, Michael A.",1,"Dmitrochenko, Oleg N.",1,"El-Arabi, M. E.",1,"Eldeeb, Alaa Emad",1,Pressure Sensors; Shock Tubes; Calibration,No topic,No topic,No topic,No topic,10,4,0,0,0,0,1,0,0,1,0,1,0,0,0,0,1,0,1,3,4,2,1,1,0,0,0,0,0,0,0,0,0,0,0,0,0,0,0,0,0,0,0,0,0,0,0,0,0,0,0,0,0,0,0,0,0,0,0,0,13,20,38,31,19,33,25,24,34,16,17,11,8,3,0,0,0,0,0,0,0,0,0,0,0,0,0,0,0,0,0,0,0,0,0,0,0,0,0,0,0,0,0,0,0,0,0,0,0,0,0,0
"Shokry, Abdallah",https://08105ofxv-1103-y-https-www-scopus-com.mplbci.ekb.eg/authid/detail.uri?authorId=56801128200,15,52,5,"Ståhle, Per",4,"Mahdi, Elsadig",3,"Aly, Mohamed Fahmy",1,"Attia, M. S.",1,"Dixon, Roger",1,"Ghani, Saud Abdul A.",1,"Gopalan, Avinash",1,"Kharma, Mohamed Yaser",1,Hot Working; Dynamic Recrystallization; Hyperbolic Sine,Extracellular Space; Caudate Nucleus; Tortuosity,T-Stress; Crack Tips; Fracture Toughness,Mandible Fracture; Maxillofacial Injuries; Third Molar,Acoustic Emissions; Condition Monitoring; Spur Gears,14,0,0,0,0,0,0,1,1,4,3,0,4,0,2,0,0,0,0,1,0,0,0,0,0,0,0,0,0,0,0,0,0,0,0,0,0,0,0,0,0,0,0,0,0,0,0,0,0,0,0,0,0,0,0,0,0,0,0,0,10,17,11,7,4,0,1,0,1,1,0,0,0,0,0,0,0,0,0,0,0,0,0,0,0,0,0,0,0,0,0,0,0,0,0,0,0,0,0,0,0,0,0,0,0,0,0,0,0,0,0,0
"Bakhoum, E. S.",https://08105ofxv-1103-y-https-www-scopus-com.mplbci.ekb.eg/authid/detail.uri?authorId=55845161500,14,133,7,"Ezz, Hesham",4,"Brown, David C.",2,"Karam, Ahmed",2,"Zaher, Khaled",2,"Brown, David C.",1,"Shouman, Enas R.",1,No Coauthor,No Coauthor,Quarries; Self Compacting Concrete; Silica Fume,Bales; Straw; Baling,Embodied Energy; Life Cycle Assessment; Green Building,Pumping; Water System; Irrigation (Agriculture),Palm Oils; Concrete Aggregates; Elaeis Guineensis,14,0,0,0,0,0,0,0,1,1,0,1,1,3,3,2,1,1,0,0,0,0,0,0,0,0,0,0,0,0,0,0,0,0,0,0,0,0,0,0,0,0,0,0,0,0,0,0,0,0,0,0,0,0,0,0,0,0,0,0,15,35,27,12,13,14,11,2,3,1,0,0,0,0,0,0,0,0,0,0,0,0,0,0,0,0,0,0,0,0,0,0,0,0,0,0,0,0,0,0,0,0,0,0,0,0,0,0,0,0,0,0
"Hosny, Sameh",https://08105ofxv-1103-y-https-www-scopus-com.mplbci.ekb.eg/authid/detail.uri?authorId=57041007400,13,55,4,"Alotaibi, Faisal",3,"El-Sherif, Amr A.",3,"Nafie, Mohammed H.",3,"AlNagar, Yousef",2,"Gabr, Badiaa",2,"Gad, Mohamed E.",2,"Mokhtar, Bassem Mahmoud",2,"Abdrabou, Mohammed Aly",1,Caching; Radio Access Networks; Zipf Distribution,Cellular Networks; Power Allocation; Relay Selection,Stream Ciphers; Cryptanalysis; Linear Feedback Shift Register,No topic,No topic,0,13,0,0,0,0,0,0,0,1,7,0,1,2,2,0,0,0,0,0,0,0,0,0,0,0,0,0,0,0,0,0,0,0,0,0,0,0,0,0,0,0,0,0,0,0,0,0,0,0,0,0,0,0,0,0,0,0,0,0,8,15,16,10,3,3,0,0,0,0,0,0,0,0,0,0,0,0,0,0,0,0,0,0,0,0,0,0,0,0,0,0,0,0,0,0,0,0,0,0,0,0,0,0,0,0,0,0,0,0,0,0
"Ahmed, Ethar A.A.",https://08105ofxv-1103-y-https-www-scopus-com.mplbci.ekb.eg/authid/detail.uri?authorId=57007781800,12,59,5,"Ghaleb, Ahmed F.",4,"Elmaklizi, Yassmin D.",2,"El-Dhaba, A. R.",1,"Mahmoud, Wael",1,No Coauthor,No Coauthor,No Coauthor,No Coauthor,Generalized Thermoelasticity; Micropolar; Phase-Lag,Peristaltic Flow; Asymmetric Channel; Hartmann Number,No topic,No topic,No topic,11,0,0,0,1,0,0,0,2,3,2,0,2,2,1,0,0,0,0,0,0,0,0,0,0,0,0,0,0,0,0,0,0,0,0,0,0,0,0,0,0,0,0,0,0,0,0,0,0,0,0,0,0,0,0,0,0,0,0,0,20,19,13,1,6,0,0,0,0,0,0,0,0,0,0,0,0,0,0,0,0,0,0,0,0,0,0,0,0,0,0,0,0,0,0,0,0,0,0,0,0,0,0,0,0,0,0,0,0,0,0,0
"Wahby Shalaby, Mohamed A.",https://08105ofxv-1103-y-https-www-scopus-com.mplbci.ekb.eg/authid/detail.uri?authorId=55322264400,12,80,3,"Ammar, Hossam Hassan",3,"Osman, Asmaa A.E.",2,"Salama, Elham S.",2,"Al Embaby, A.",1,"Beb, Mayra Yucely",1,"Boubakari, Abdoulaye",1,"Darwish, Ahmed M.",1,"Elmahdy, Hesham Nabih",1,Robot Learning; Imitation; Primitive,Emotion Recognition; Electroencephalography; Brain Computer Interface,No topic,No topic,No topic,5,7,0,0,0,0,0,0,0,7,0,1,2,0,0,0,1,0,0,0,0,0,0,0,0,0,0,1,0,0,0,0,0,0,0,0,0,0,0,0,0,0,0,0,0,0,0,0,0,0,0,0,0,0,0,0,0,0,0,0,16,40,10,0,2,2,5,2,2,1,0,0,0,0,0,0,0,0,0,0,0,0,0,0,0,0,0,0,0,0,0,0,0,0,0,0,0,0,0,0,0,0,0,0,0,0,0,0,0,0,0,0
"Awny, Mohamed Mamdouh",https://08105ofxv-1103-y-https-www-scopus-com.mplbci.ekb.eg/authid/detail.uri?authorId=8503356600,11,28,2,"Alenezi, J. K.",1,"Diab, Ziad",1,"El-Katatny, Mai Gamal",1,"Elgezery, Hanan Wagih",1,"Fahmy, Maged M.M.",1,"Fayed, Ahmed Mohamed",1,"Hegazy, Mostafa",1,"Ibrahim, Asmaa Abdelrehim Selim",1,Entrepreneurial University; Academic Entrepreneurship; University Technology Transfer,Business Model Innovation; Sustainable Business; Digital Transformation,No topic,No topic,No topic,1,8,1,0,1,0,0,0,0,6,0,0,1,1,0,0,0,0,0,0,1,0,0,1,1,0,0,0,0,0,0,0,0,0,0,0,0,0,0,0,0,0,0,0,0,0,0,0,0,0,0,0,0,0,0,0,0,0,0,0,1,0,3,2,2,0,0,1,1,4,2,3,3,3,2,1,0,0,0,0,0,0,0,0,0,0,0,0,0,0,0,0,0,0,0,0,0,0,0,0,0,0,0,0,0,0,0,0,0,0,0,0
"Gaber, Ayman",https://08105ofxv-1103-y-https-www-scopus-com.mplbci.ekb.eg/authid/detail.uri?authorId=56240981000,11,13,1,"Abdullah, Kareem",3,"Elezabi, Ayman Y.",3,"Gadallah, Yasser",3,"Seddik, Karim G.",3,"Roshdy, Ashraf",2,"Abdelbaki, Nashwa",1,"Aboelwafa, Mariam M.N.",1,"Attalla, Sara A.",1,Handover; Local Thermodynamic Equilibrium; Self-Optimization,HTTP; Video Streaming; Adaptive Dynamics,No topic,No topic,No topic,0,11,0,0,0,0,0,0,0,6,2,1,1,0,0,1,0,0,0,0,0,0,0,0,0,0,0,0,0,0,0,0,0,0,0,0,0,0,0,0,0,0,0,0,0,0,0,0,0,0,0,0,0,0,0,0,0,0,0,0,3,6,4,0,0,0,0,0,0,0,0,0,0,0,0,0,0,0,0,0,0,0,0,0,0,0,0,0,0,0,0,0,0,0,0,0,0,0,0,0,0,0,0,0,0,0,0,0,0,0,0,0
"Hamed, Esraa M.",https://08105ofxv-1103-y-https-www-scopus-com.mplbci.ekb.eg/authid/detail.uri?authorId=57195129089,10,97,6,"Said, Lobna A.",5,"Madian, Ahmed H.",4,"AbdelAty, Amr M.",2,"Rashad, Somia H.",2,"Alharbi, Abdullah G.",1,"Badr, Eman",1,"Elsafty, Abdulaziz H.",1,"Elsharqawy, Omar",1,Memristors; RRAM; Chaotic Circuit,Fractional Order; Differentiators; Low Pass Filters,Charge Pump Circuits; Energy Harvesting; DC-DC Converter,Hardware Description Languages; RTL; Time to Market,No topic,4,6,0,0,0,0,0,0,0,1,1,5,3,0,0,0,0,0,0,0,0,0,0,0,0,0,0,0,0,0,0,0,0,0,0,0,0,0,0,0,0,0,0,0,0,0,0,0,0,0,0,0,0,0,0,0,0,0,0,0,25,27,31,13,1,0,0,0,0,0,0,0,0,0,0,0,0,0,0,0,0,0,0,0,0,0,0,0,0,0,0,0,0,0,0,0,0,0,0,0,0,0,0,0,0,0,0,0,0,0,0,0
"Rezk, Ahmed A.",https://08105ofxv-1103-y-https-www-scopus-com.mplbci.ekb.eg/authid/detail.uri?authorId=56673970800,10,143,5,"Soliman, Ahmed M.",5,"Abu-ElYazeed, Mohamed Fathy",3,"Helmy, Amr",3,"Ismail, Samar Moustafa",3,"Ismail, Yehea I.",3,"Said, Lobna A.",3,"Fahmy, Hossam A. H.",2,"Sayed, Wafaa S.",2,Chaotic Attractor; Chua's Circuit; Scroll,Image Encryption; Chaotic Map; Hyperchaotic System,Inductors; DC-DC Converter; Bucks,Fractional Order; Differentiators; Low Pass Filters,No topic,5,5,0,0,0,0,0,0,0,1,1,0,5,0,2,0,1,0,0,0,0,0,0,0,0,0,0,0,0,0,0,0,0,0,0,0,0,0,0,0,0,0,0,0,0,0,0,0,0,0,0,0,0,0,0,0,0,0,0,0,15,49,46,29,1,0,3,0,0,0,0,0,0,0,0,0,0,0,0,0,0,0,0,0,0,0,0,0,0,0,0,0,0,0,0,0,0,0,0,0,0,0,0,0,0,0,0,0,0,0,0,0
"Soliman, Nancy S.",https://08105ofxv-1103-y-https-www-scopus-com.mplbci.ekb.eg/authid/detail.uri?authorId=57194544067,10,193,5,"Said, Lobna A.",8,"Fouda, Mohammed E.",5,"Tolba, Mohamed F.",3,"Azar, Ahmad Taher",2,"AbdelAty, Amr M.",1,"Alharbi, Abdullah G.",1,"Alhurbi, Abdullah G.",1,"Ounnas, Adel",1,Memristors; RRAM; Chaotic Circuit,Chaotic Attractor; Chua's Circuit; Scroll,Asynchronous Circuits; Synchronizers; Network on Chip,Carbon Nanotube Field Effect Transistors; Multiple-Valued Logic; Combinatorial Circuits,Fractional Order; Differentiators; Low Pass Filters,4,6,0,0,0,0,0,0,0,0,4,4,2,0,0,0,0,0,0,0,0,0,0,0,0,0,0,0,0,0,0,0,0,0,0,0,0,0,0,0,0,0,0,0,0,0,0,0,0,0,0,0,0,0,0,0,0,0,0,0,23,58,45,66,1,0,0,0,0,0,0,0,0,0,0,0,0,0,0,0,0,0,0,0,0,0,0,0,0,0,0,0,0,0,0,0,0,0,0,0,0,0,0,0,0,0,0,0,0,0,0,0
"Elsafty, Abdulaziz H.",https://08105ofxv-1103-y-https-www-scopus-com.mplbci.ekb.eg/authid/detail.uri?authorId=57202986074,9,37,5,"Said, Lobna A.",9,"Tolba, Mohamed F.",6,"Hassanein, Ahmed M.",2,"Armanyos, Mina",1,"Fouda, Mohammed E.",1,"Hamed, Esraa M.",1,No Coauthor,No Coauthor,Memristors; RRAM; Chaotic Circuit,Fractional Order; Differentiators; Low Pass Filters,No topic,No topic,No topic,4,4,0,0,1,0,0,0,1,2,3,3,0,0,0,0,0,0,0,0,0,0,0,0,0,0,0,0,0,0,0,0,0,0,0,0,0,0,0,0,0,0,0,0,0,0,0,0,0,0,0,0,0,0,0,0,0,0,0,0,14,12,10,1,0,0,0,0,0,0,0,0,0,0,0,0,0,0,0,0,0,0,0,0,0,0,0,0,0,0,0,0,0,0,0,0,0,0,0,0,0,0,0,0,0,0,0,0,0,0,0,0
"Omran, Mohammed Fawzy",https://08105ofxv-1103-y-https-www-scopus-com.mplbci.ekb.eg/authid/detail.uri?authorId=55412327600,9,25,3,No Coauthor,No Coauthor,No Coauthor,No Coauthor,No Coauthor,No Coauthor,No Coauthor,No Coauthor,Women Entrepreneurs; Self-Employment; Ethnic Business,No topic,No topic,No topic,No topic,8,0,0,0,1,0,0,0,0,0,0,1,0,0,0,0,1,0,1,0,0,0,1,0,0,0,1,0,0,0,1,1,2,0,0,0,0,0,0,0,0,0,0,0,0,0,0,0,0,0,0,0,0,0,0,0,0,0,0,0,0,1,2,3,2,1,0,1,4,2,2,2,0,1,0,1,0,0,0,1,1,1,0,0,0,0,0,0,0,0,0,0,0,0,0,0,0,0,0,0,0,0,0,0,0,0,0,0,0,0,0,0
"Salaheldin, Ahmed",https://08105ofxv-1103-y-https-www-scopus-com.mplbci.ekb.eg/authid/detail.uri?authorId=36081995600,9,40,5,"Alsebai, A.",3,"ElSayed, Mahmoud Said",2,"Elkerdawy, Sara",2,"El Sayed, M.",1,"El-Helw, Mohamed",1,"Eldesokey, Abdelrahman",1,"Elkerdawi, Sara Maher",1,"Maher, Sara",1,No topic,No topic,No topic,No topic,No topic,0,9,0,0,0,0,0,0,0,0,0,0,0,0,0,3,1,1,0,4,0,0,0,0,0,0,0,0,0,0,0,0,0,0,0,0,0,0,0,0,0,0,0,0,0,0,0,0,0,0,0,0,0,0,0,0,0,0,0,0,1,0,4,3,1,9,3,6,6,3,1,3,0,0,0,0,0,0,0,0,0,0,0,0,0,0,0,0,0,0,0,0,0,0,0,0,0,0,0,0,0,0,0,0,0,0,0,0,0,0,0,0
"Elwy, Omar",https://08105ofxv-1103-y-https-www-scopus-com.mplbci.ekb.eg/authid/detail.uri?authorId=57204176272,8,50,3,"Madian, Ahmed H.",6,"Soliman, Ahmed M.",3,"AbdelAty, Amr M.",2,"Hassanein, Ahmed M.",1,"Rashad, Somia H.",1,No Coauthor,No Coauthor,No Coauthor,Fractional Order; Differentiators; Low Pass Filters,No topic,No topic,No topic,No topic,5,2,0,0,0,0,1,0,1,1,4,2,0,0,0,0,0,0,0,0,0,0,0,0,0,0,0,0,0,0,0,0,0,0,0,0,0,0,0,0,0,0,0,0,0,0,0,0,0,0,0,0,0,0,0,0,0,0,0,0,17,24,9,0,0,0,0,0,0,0,0,0,0,0,0,0,0,0,0,0,0,0,0,0,0,0,0,0,0,0,0,0,0,0,0,0,0,0,0,0,0,0,0,0,0,0,0,0,0,0,0,0
"Mohsen, Menna",https://08105ofxv-1103-y-https-www-scopus-com.mplbci.ekb.eg/authid/detail.uri?authorId=57211289614,8,23,3,"Elwakil, Ahmed S.",6,"Madian, Ahmed H.",6,"AboBakr, Ahmed",2,"Bertsias, Panagiotis",1,"Ghoneim, Mohamed S.",1,"Mohammaden, Amr A.",1,"Psychalinos, Costas",1,"Roshdy, Merna",1,Fractional Order; Differentiators; Low Pass Filters,Bioelectrical Impedance; RC Circuit; Sweep Frequency,No topic,No topic,No topic,4,4,0,0,0,0,0,0,2,3,3,0,0,0,0,0,0,0,0,0,0,0,0,0,0,0,0,0,0,0,0,0,0,0,0,0,0,0,0,0,0,0,0,0,0,0,0,0,0,0,0,0,0,0,0,0,0,0,0,0,17,6,0,0,0,0,0,0,0,0,0,0,0,0,0,0,0,0,0,0,0,0,0,0,0,0,0,0,0,0,0,0,0,0,0,0,0,0,0,0,0,0,0,0,0,0,0,0,0,0,0,0
"AboBakr, Ahmed",https://08105ofxv-1103-y-https-www-scopus-com.mplbci.ekb.eg/authid/detail.uri?authorId=57203044258,7,132,4,"Said, Lobna A.",5,"Madian, Ahmed H.",4,"Mohsen, Menna",2,"AbdelAty, Amr M.",1,"Azer, Marianne Amir",1,"Eltawil, Ahmed M.",1,"Fouda, Mohammed E.",1,"Mousa, Mostafa A.",1,Fractional Order; Differentiators; Low Pass Filters,Fog Computing; Blockchain; Internet of Things,Bioelectrical Impedance; RC Circuit; Sweep Frequency,Impedance Spectroscopy; Electrical Method; Equivalent Circuits,No topic,2,5,0,0,0,0,0,0,0,0,4,1,2,0,0,0,0,0,0,0,0,0,0,0,0,0,0,0,0,0,0,0,0,0,0,0,0,0,0,0,0,0,0,0,0,0,0,0,0,0,0,0,0,0,0,0,0,0,0,0,20,56,36,19,1,0,0,0,0,0,0,0,0,0,0,0,0,0,0,0,0,0,0,0,0,0,0,0,0,0,0,0,0,0,0,0,0,0,0,0,0,0,0,0,0,0,0,0,0,0,0,0
"Kishk, Ali",https://08105ofxv-1103-y-https-www-scopus-com.mplbci.ekb.eg/authid/detail.uri?authorId=57204779310,7,50,4,"Bensellak, Taoufik",2,"Fadlelmola, Faisal M.",2,"Ghansah, Anita K.",2,"Ghouila, Amel",2,"Moussa, Ahmed",2,"Mulder, Nicola J.",2,"Musicha, Patrick",2,"Wells, Gordon",2,Human Heredity; Bioinformatics; Life Sciences,Metagenome; Binning; Microbial Genome,Mycobiome; RNA Gene; Otus,Beta 2 Adrenergic Receptor; Asthma; Pharmacogenomics,Colibactin; Fusobacterium Nucleatum; Intestine Flora,3,3,0,1,0,0,0,0,0,0,6,1,0,0,0,0,0,0,0,0,0,0,0,0,0,0,0,0,0,0,0,0,0,0,0,0,0,0,0,0,0,0,0,0,0,0,0,0,0,0,0,0,0,0,0,0,0,0,0,0,17,28,5,0,0,0,0,0,0,0,0,0,0,0,0,0,0,0,0,0,0,0,0,0,0,0,0,0,0,0,0,0,0,0,0,0,0,0,0,0,0,0,0,0,0,0,0,0,0,0,0,0
"Mohammed, Ayman R.",https://08105ofxv-1103-y-https-www-scopus-com.mplbci.ekb.eg/authid/detail.uri?authorId=57212308335,7,0,0,"AbdelSalam, Sherif S.",1,"Abdelal, Mohamed A.",1,"Afifi, Mohamed S.",1,"Alhubaishy, Yousef A.",1,"Mohamed, Mostafa O.",1,"Nasser, Kareem A.",1,"Wahby Shalaby, Mohamed A.",1,No Coauthor,Steel Fibers; Self Compacting Concrete; Concrete Slabs,No topic,No topic,No topic,No topic,1,6,0,0,0,0,0,0,0,6,1,0,0,0,0,0,0,0,0,0,0,0,0,0,0,0,0,0,0,0,0,0,0,0,0,0,0,0,0,0,0,0,0,0,0,0,0,0,0,0,0,0,0,0,0,0,0,0,0,0,0,0,0,0,0,0,0,0,0,0,0,0,0,0,0,0,0,0,0,0,0,0,0,0,0,0,0,0,0,0,0,0,0,0,0,0,0,0,0,0,0,0,0,0,0,0,0,0,0,0,0,0
"Saleh, Mahmood Abdallah",https://08105ofxv-1103-y-https-www-scopus-com.mplbci.ekb.eg/authid/detail.uri?authorId=57203917895,7,23,3,"Ammar, Hossam Hassan",3,"Radwan, Ahmed G.",3,"Azar, Ahmad Taher",2,"Elsamanty, M.",2,"Abdelwahed, Mohamed Abdallah",1,"Barakat, Mohamed Hesham",1,"Wahby Shalaby, Mohamed A.",1,No Coauthor,Inverted Pendulum; Mobile Robots; Nonholonomic Constraints,No topic,No topic,No topic,No topic,2,4,0,0,1,0,0,0,1,5,1,0,0,0,0,0,0,0,0,0,0,0,0,0,0,0,0,0,0,0,0,0,0,0,0,0,0,0,0,0,0,0,0,0,0,0,0,0,0,0,0,0,0,0,0,0,0,0,0,0,3,17,3,0,0,0,0,0,0,0,0,0,0,0,0,0,0,0,0,0,0,0,0,0,0,0,0,0,0,0,0,0,0,0,0,0,0,0,0,0,0,0,0,0,0,0,0,0,0,0,0,0
"Selim, Sahar",https://08105ofxv-1103-y-https-www-scopus-com.mplbci.ekb.eg/authid/detail.uri?authorId=57191887166,7,45,2,"Tantawi, Manal Mohsen",4,"Abouelsaadat, Wael",1,"Elhinamy, Ethar",1,"Fangoh, Ahmed Mabrouk",1,"Othman, Hisham A.",1,"Salem, Mohammed Abdel Megeed M.",1,No Coauthor,No Coauthor,Motor Imagery; Brain Computer Interface; Visual Evoked Potentials,Seizures; Electrocorticography; Epilepsy,No topic,No topic,No topic,1,6,0,0,0,0,0,0,1,2,2,1,1,0,0,0,0,0,0,0,0,0,0,0,0,0,0,0,0,0,0,0,0,0,0,0,0,0,0,0,0,0,0,0,0,0,0,0,0,0,0,0,0,0,0,0,0,0,0,0,9,23,13,0,0,0,0,0,0,0,0,0,0,0,0,0,0,0,0,0,0,0,0,0,0,0,0,0,0,0,0,0,0,0,0,0,0,0,0,0,0,0,0,0,0,0,0,0,0,0,0,0
"El-Helw, Mohamed",https://08105ofxv-1103-y-https-www-scopus-com.mplbci.ekb.eg/authid/detail.uri?authorId=55545967500,6,13,2,"Yogamani, Senthil Kumar",2,"Das, Arindam",1,"El-Sayed, Agwad",1,"Elrahman, Ahmed Abd",1,"Elshawi, Radwa",1,"Křížek, Pavel",1,"Maher, Sara",1,"Sakr, Sherif",1,No topic,No topic,No topic,No topic,No topic,0,6,0,0,0,0,0,0,0,1,2,0,0,0,0,0,2,1,0,0,0,0,0,0,0,0,0,0,0,0,0,0,0,0,0,0,0,0,0,0,0,0,0,0,0,0,0,0,0,0,0,0,0,0,0,0,0,0,0,0,0,0,4,1,1,3,2,1,1,0,0,0,0,0,0,0,0,0,0,0,0,0,0,0,0,0,0,0,0,0,0,0,0,0,0,0,0,0,0,0,0,0,0,0,0,0,0,0,0,0,0,0
"Ghoneim, Mohamed S.",https://08105ofxv-1103-y-https-www-scopus-com.mplbci.ekb.eg/authid/detail.uri?authorId=57220091504,6,5,1,"Hesham, Rana",2,"Mohammaden, Amr A.",2,"Radwan, Ahmed G.",2,"Said, Lobna A.",2,"Elgharib, Yousef H.",1,"Hatem, Shahenda",1,"Khalil, Nariman A.",1,"Mohsen, Menna",1,Smart Cities; Municipal Administration; Internet of Things,No topic,No topic,No topic,No topic,2,4,0,0,0,0,0,0,2,3,1,0,0,0,0,0,0,0,0,0,0,0,0,0,0,0,0,0,0,0,0,0,0,0,0,0,0,0,0,0,0,0,0,0,0,0,0,0,0,0,0,0,0,0,0,0,0,0,0,0,0,5,0,0,0,0,0,0,0,0,0,0,0,0,0,0,0,0,0,0,0,0,0,0,0,0,0,0,0,0,0,0,0,0,0,0,0,0,0,0,0,0,0,0,0,0,0,0,0,0,0,0
"Hassanein, Ahmed M.",https://08105ofxv-1103-y-https-www-scopus-com.mplbci.ekb.eg/authid/detail.uri?authorId=57193562434,6,12,2,"Said, Lobna A.",4,"Dakheel, M. M.",2,"Elsafty, Abdulaziz H.",2,"Ahmed, Rania F.",1,"Elwy, Omar",1,"Fouad, R. A.",1,"Soliman, Ahmed M.",1,"Soltan, Ahmed",1,Memristors; RRAM; Chaotic Circuit,Fractional Order; Differentiators; Low Pass Filters,No topic,No topic,No topic,1,5,0,0,0,0,0,0,0,0,3,1,0,2,0,0,0,0,0,0,0,0,0,0,0,0,0,0,0,0,0,0,0,0,0,0,0,0,0,0,0,0,0,0,0,0,0,0,0,0,0,0,0,0,0,0,0,0,0,0,3,3,5,0,1,0,0,0,0,0,0,0,0,0,0,0,0,0,0,0,0,0,0,0,0,0,0,0,0,0,0,0,0,0,0,0,0,0,0,0,0,0,0,0,0,0,0,0,0,0,0,0
"Karam, Ahmed",https://08105ofxv-1103-y-https-www-scopus-com.mplbci.ekb.eg/authid/detail.uri?authorId=57195722107,6,22,3,"Bakhoum, E. S.",2,"Elawwad, Abdelsalam",2,"Mostafa, Mohamed K.",2,"Peters, Robert W.",2,"Elshfai, Maha M.",1,"Farag, Rabie Saad",1,No Coauthor,No Coauthor,Photobioreactors; Nutrient Removal; Scenedesmus,Iron Nanoparticle; Dechlorination; Reactive Barrier,No topic,No topic,No topic,4,2,0,0,0,0,0,0,1,2,2,0,1,0,0,0,0,0,0,0,0,0,0,0,0,0,0,0,0,0,0,0,0,0,0,0,0,0,0,0,0,0,0,0,0,0,0,0,0,0,0,0,0,0,0,0,0,0,0,0,12,8,2,0,0,0,0,0,0,0,0,0,0,0,0,0,0,0,0,0,0,0,0,0,0,0,0,0,0,0,0,0,0,0,0,0,0,0,0,0,0,0,0,0,0,0,0,0,0,0,0,0
"Kasem, Tamer H.M.A.",https://08105ofxv-1103-y-https-www-scopus-com.mplbci.ekb.eg/authid/detail.uri?authorId=36559596500,6,16,2,"Azmy, Amir",1,"Briganti, Riccardo",1,"Dodd, Nicholas",1,"El-Sakka, Alia",1,"Elhadidi, Basman M.",1,"Guaily, Amr G.",1,"Hafez, Ahmed H.",1,"Madhouly Abdelrahman, Mohamed",1,Trombe Walls; Solar Chimneys; Natural Ventilation,No topic,No topic,No topic,No topic,2,4,0,0,0,0,0,0,1,1,1,0,0,0,0,0,0,0,0,3,0,0,0,0,0,0,0,0,0,0,0,0,0,0,0,0,0,0,0,0,0,0,0,0,0,0,0,0,0,0,0,0,0,0,0,0,0,0,0,0,0,3,4,2,2,0,1,0,1,2,0,1,0,0,0,0,0,0,0,0,0,0,0,0,0,0,0,0,0,0,0,0,0,0,0,0,0,0,0,0,0,0,0,0,0,0,0,0,0,0,0,0
"Lotfy, Amr M.",https://08105ofxv-1103-y-https-www-scopus-com.mplbci.ekb.eg/authid/detail.uri?authorId=36904246600,6,14,2,"Ismail, Yehea I.",3,"Kurd, Nasser A.",3,"Abdelfattah, Moataz A.",2,"Taylor, Greg F.",2,"Abdelsalam, Mohamed",1,"Farooq, Syed Feruz",1,"Mosalikanti, Praveen",1,"Safwat, Sally",1,All-Digital; Phase Locked Loops; Jitter,Decision Feedback Equalizers; Equalizers (Circuits); Pulse Amplitude Modulation,No topic,No topic,No topic,1,5,0,0,0,0,0,0,0,0,0,0,0,1,1,0,0,3,1,0,0,0,0,0,0,0,0,0,0,0,0,0,0,0,0,0,0,0,0,0,0,0,0,0,0,0,0,0,0,0,0,0,0,0,0,0,0,0,0,0,0,2,4,4,2,2,0,0,0,0,0,0,0,0,0,0,0,0,0,0,0,0,0,0,0,0,0,0,0,0,0,0,0,0,0,0,0,0,0,0,0,0,0,0,0,0,0,0,0,0,0,0
"Mousa, Mostafa A.",https://08105ofxv-1103-y-https-www-scopus-com.mplbci.ekb.eg/authid/detail.uri?authorId=57215287388,6,7,2,"Soliman, Menna Allah",4,"Elsamanty, M.",2,"AboBakr, Ahmed",1,"ElHussieny, Amal",1,"Elwakil, Ahmed S.",1,"Everitt, Nicola M.",1,"Fahim, Irene Samy",1,"Faisal, Marwa",1,Impedance Spectroscopy; Electrical Method; Equivalent Circuits,No topic,No topic,No topic,No topic,3,2,0,0,1,0,0,0,2,3,1,0,0,0,0,0,0,0,0,0,0,0,0,0,0,0,0,0,0,0,0,0,0,0,0,0,0,0,0,0,0,0,0,0,0,0,0,0,0,0,0,0,0,0,0,0,0,0,0,0,2,5,0,0,0,0,0,0,0,0,0,0,0,0,0,0,0,0,0,0,0,0,0,0,0,0,0,0,0,0,0,0,0,0,0,0,0,0,0,0,0,0,0,0,0,0,0,0,0,0,0,0
"Shoukry, Omar K.",https://08105ofxv-1103-y-https-www-scopus-com.mplbci.ekb.eg/authid/detail.uri?authorId=55813650200,6,160,3,"ElBatt, Tamer A.",2,"Wanas, Nayer M.",2,"Abd El Mohsen, Mohamed A.",1,"Abdelkader, Ahmed I.",1,"El-Laithy, Hanan M.",1,"Elmohsen, M. Abd",1,"Elnakieb, Yaser A.",1,"Khairy, Mohamed M.",1,No topic,No topic,No topic,No topic,No topic,1,5,0,0,0,0,0,0,0,0,0,0,0,0,0,1,4,0,1,0,0,0,0,0,0,0,0,0,0,0,0,0,0,0,0,0,0,0,0,0,0,0,0,0,0,0,0,0,0,0,0,0,0,0,0,0,0,0,0,0,8,22,19,15,14,22,20,14,13,11,2,0,0,0,0,0,0,0,0,0,0,0,0,0,0,0,0,0,0,0,0,0,0,0,0,0,0,0,0,0,0,0,0,0,0,0,0,0,0,0,0,0
"Soliman, Menna Allah",https://08105ofxv-1103-y-https-www-scopus-com.mplbci.ekb.eg/authid/detail.uri?authorId=57208177012,6,15,2,"Radwan, Ahmed G.",3,"Ammar, Hossam Hassan",2,"Elsamanty, M.",2,"Azar, Ahmad Taher",1,"Wahby Shalaby, Mohamed A.",1,No Coauthor,No Coauthor,No Coauthor,No topic,No topic,No topic,No topic,No topic,2,3,0,0,1,0,0,0,1,5,0,0,0,0,0,0,0,0,0,0,0,0,0,0,0,0,0,0,0,0,0,0,0,0,0,0,0,0,0,0,0,0,0,0,0,0,0,0,0,0,0,0,0,0,0,0,0,0,0,0,3,11,0,0,0,0,0,0,0,0,0,0,0,0,0,0,0,0,0,0,0,0,0,0,0,0,0,0,0,0,0,0,0,0,0,0,0,0,0,0,0,0,0,0,0,0,0,0,0,0,0,0
"Taie, Mostafa Anwar",https://08105ofxv-1103-y-https-www-scopus-com.mplbci.ekb.eg/authid/detail.uri?authorId=55613285100,6,18,2,"El-Faramawy, Ibrahim",1,"Elmawazini, Mohamed",1,"Moawad, Eman Magdy",1,"Nagiub, Mena",1,"Nasreldin, Karim Mohammed",1,"Sadik, Mostafa",1,No Coauthor,No Coauthor,Concurrency; Deadlock; Atomicity,Execution Time; Timing Analysis; Cache,Range Finders; Lidar; Laser Scanner,Advanced Driver Assistance Systems; Road Traffic; Crashes,No topic,1,5,0,0,0,0,0,0,0,0,0,0,0,2,2,0,1,1,0,0,0,0,0,0,0,0,0,0,0,0,0,0,0,0,0,0,0,0,0,0,0,0,0,0,0,0,0,0,0,0,0,0,0,0,0,0,0,0,0,0,1,3,3,6,1,4,0,0,0,0,0,0,0,0,0,0,0,0,0,0,0,0,0,0,0,0,0,0,0,0,0,0,0,0,0,0,0,0,0,0,0,0,0,0,0,0,0,0,0,0,0,0
"Wafa, Mohamed I.",https://08105ofxv-1103-y-https-www-scopus-com.mplbci.ekb.eg/authid/detail.uri?authorId=54403992500,6,16,2,"El-Naggar, Sahar A.",2,"Elboushi, Mostafa Khaled",1,"Elgharably, Mohamed Hesham",1,"Galal, Osama H.",1,"Nagy, Shady Ahmed",1,No Coauthor,No Coauthor,No Coauthor,Chaotic Attractor; Chua's Circuit; Scroll,No topic,No topic,No topic,No topic,4,2,0,0,0,0,0,0,1,2,1,0,0,0,0,0,1,0,1,0,0,0,0,0,0,0,0,0,0,0,0,0,0,0,0,0,0,0,0,0,0,0,0,0,0,0,0,0,0,0,0,0,0,0,0,0,0,0,0,0,3,7,1,0,1,2,2,0,0,0,0,0,0,0,0,0,0,0,0,0,0,0,0,0,0,0,0,0,0,0,0,0,0,0,0,0,0,0,0,0,0,0,0,0,0,0,0,0,0,0,0,0
"Yassin, Heba M.",https://08105ofxv-1103-y-https-www-scopus-com.mplbci.ekb.eg/authid/detail.uri?authorId=57205215264,6,10,2,"El-Batawy, Yasser M.",2,"Madian, Ahmed H.",2,"Mahran, Sara E.",2,"Psychalinos, Costas",2,"Said, Lobna A.",2,"Abdel-Gawad, Ahmed H.",1,"Ghoneim, Mohamed S.",1,"Hesham, Rana",1,Image Encryption; Chaotic Map; Hyperchaotic System,Thin Film Solar Cells; Organic Photovoltaics; Plasmonics,Fractional Order; Differentiators; Low Pass Filters,No topic,No topic,3,3,0,0,0,0,0,0,1,2,3,0,0,0,0,0,0,0,0,0,0,0,0,0,0,0,0,0,0,0,0,0,0,0,0,0,0,0,0,0,0,0,0,0,0,0,0,0,0,0,0,0,0,0,0,0,0,0,0,0,3,7,0,0,0,0,0,0,0,0,0,0,0,0,0,0,0,0,0,0,0,0,0,0,0,0,0,0,0,0,0,0,0,0,0,0,0,0,0,0,0,0,0,0,0,0,0,0,0,0,0,0
